<?xml version="1.0" encoding="UTF-8" ?>

<tariffs xmlns:xsi="http://www.w3.org/2001/XMLSchema-instance"
         xmlns="http://www.epam.com/tariffs"
         xsi:schemaLocation="http://www.epam.com/tariffs tariffs_schema.xsd">

    <calling-tariff id="AAAAAAAA" name="Супер max">
        <payroll>
            <rubles>20</rubles>
            <kopecks>0</kopecks>
        </payroll>
        <connecting-cost>
            <rubles>5</rubles>
            <kopecks>0</kopecks>
        </connecting-cost>
        <call-inside-the-network>
            <rubles>0</rubles>
            <kopecks>0</kopecks>
        </call-inside-the-network>
        <call-outside-the-network>
            <rubles>0</rubles>
            <kopecks>0</kopecks>
        </call-outside-the-network>
        <call-to-favourite-number>
            <rubles>0</rubles>
            <kopecks>0</kopecks>
        </call-to-favourite-number>
        <favorite-numbers-count>0</favorite-numbers-count>
    </calling-tariff>
</tariffs>

